<?xml version="1.0" encoding="utf-8" standalone="no"?>
<MapbuilderConfig version="0.2.1" id="simpleTemplate" xmlns="http://mapbuilder.sourceforge.net/mapbuilder" xmlns:xsi="http://www.w3.org/2001/XMLSchema-instance" xsi:schemaLocation="http://mapbuilder.sourceforge.net/mapbuilder ../../lib/schemas/config.xsd">
	<models>
		<Context id="mainMap">
			<defaultModelUrl>../data/context/demisWorldMap.xml</defaultModelUrl>
			<widgets>
				<MapPaneOL id="mainMapWidget">
					<htmlTagId>mainMapPane</htmlTagId>
					<mapContainerId>mainMapContainer</mapContainerId>
				</MapPaneOL>
        <!--Loading2 id="loading2">
					<mapContainerId>mainMapContainer</mapContainerId>
        </Loading2-->
			</widgets>
			<tools>
			</tools>
		</Context>
	</models>
	<widgets>
		<ZoomIn id="zoomIn">
			<buttonBar>mainButtonBar</buttonBar>
			<targetModel>mainMap</targetModel>
			<class>RadioButton</class>
			<selected>true</selected>
			<enabledSrc>/images/ZoomInEnable.png</enabledSrc>
			<disabledSrc>/images/ZoomInDisable.png</disabledSrc>
		</ZoomIn>
		<ZoomOut id="zoomOut">
			<buttonBar>mainButtonBar</buttonBar>
			<targetModel>mainMap</targetModel>
			<class>RadioButton</class>
			<enabledSrc>/images/ZoomOutEnable.png</enabledSrc>
			<disabledSrc>/images/ZoomOutDisable.png</disabledSrc>
		</ZoomOut>
		<DragPan id="dragPan">
			<buttonBar>mainButtonBar</buttonBar>
			<targetModel>mainMap</targetModel>
			<class>RadioButton</class>
			<enabledSrc>/images/PanEnable.png</enabledSrc>
			<disabledSrc>/images/PanDisable.png</disabledSrc>
		</DragPan>
		<Reset id="reset">
			<buttonBar>mainButtonBar</buttonBar>
			<targetModel>mainMap</targetModel>
			<class>Button</class>
			<disabledSrc>/images/ResetExtentDisable.png</disabledSrc>
		</Reset>
	</widgets>
	<skinDir>../../lib/skin/default</skinDir>
	<widgetTextUrl>widgetText.xml</widgetTextUrl>
	<!-- relative to the skin dir -->
</MapbuilderConfig>
