<?xml version="1.0" encoding="utf-8" standalone="no" ?>

<MapbuilderConfig version="0.2.1" 
    id="WFSDemoConfig" 
    xmlns="http://mapbuilder.sourceforge.net/mapbuilder" 
    xmlns:xsi="http://www.w3.org/2001/XMLSchema-instance" 
    xsi:schemaLocation="http://mapbuilder.sourceforge.net/mapbuilder ../../lib/schemas/config.xsd">
  <!--
    Description: This configuration file determines what components from the
                 Mapbuilder library are to be included in a Main Mapbuilder web
                 page.
    Licence:     GPL as per: http://www.gnu.org/copyleft/gpl.html 

    $Id$
  -->

  <models>

    <Context id="mainMap">
      <defaultModelUrl>context/atlasWorld.xml</defaultModelUrl>
      
      <widgets>
        <MapPane id="mainMapWidget">
          <htmlTagId>mainMapPane</htmlTagId>
          <loadHidden>false</loadHidden>
          <tools>
            <AoiMouseHandler/>
            <AoiBox>
              <lineColor>#FF0000</lineColor>
              <lineWidth>2</lineWidth>
              <crossSize>1</crossSize>
            </AoiBox>
            <DragPanHandler>
              <enabled>false</enabled>
            </DragPanHandler>
          </tools>
          <mapContainerId>mainMapContainer</mapContainerId>
        </MapPane>
        <CursorTrack id="cursorTrack">
          <mouseHandler>mainMap.mainMapWidget</mouseHandler>
        </CursorTrack>
            
        <Legend id="legend"/>
        
        <Widget id="mapTitle">
          <stylesheet>/mapbuilder/lib/widget/MapTitle.xsl</stylesheet>
        </Widget>

      </widgets>
        
    </Context>
      
    <Context id="locator">
      <defaultModelUrl>context/locatorMap.xml</defaultModelUrl>
      <widgets>
        <MapPane id="locatorWidget">
          <htmlTagId>locatorMap</htmlTagId>
          <targetModel>mainMap</targetModel>
          <tools>
            <AoiBox>
              <lineColor>red</lineColor>
              <lineWidth>1</lineWidth>
              <crossSize>15</crossSize>
            </AoiBox>
            <AoiMouseHandler/>
            <ZoomToAoi>
            </ZoomToAoi>
          </tools>
          <mapContainerId>locatorContainer</mapContainerId>
          <fixedWidth>180</fixedWidth>
        </MapPane>
      </widgets>
    </Context>
    
  <!-- use this with a WFS capabilities model -->
  
		<WfsCapabilities id="wfsCapTemplate">
      <defaultModelUrl>http://webservices.ionicsoft.com/ionicweb/wfs/BOSTON_ORA?version=1.0.0&amp;service=WFS&amp;request=GetCapabilities</defaultModelUrl>
      <nodeSelectXpath>/wfs:WFS_Capabilities/wfs:FeatureTypeList/wfs:FeatureType</nodeSelectXpath>
      <models>
        <DescribeFeatureType id="featureTypeTemplate" template="true">
          <widgets>
            <Widget id="attributeFilter">
              <stylesheet>/mapbuilder/lib/widget/FilterAttributes.xsl</stylesheet>
              <outputNodeId>filterForm</outputNodeId>
            </Widget>
          </widgets>
        </DescribeFeatureType>
        <GetFeature id="getFeatureTemplate" template="true">
          <widgets>
            <GmlRendererTest id="testGmlRenderer">
              <targetModel>mainMap</targetModel>
              <htmlTagId>mainMapPane</htmlTagId>
              <mapContainerId>mainMapContainer</mapContainerId>
            </GmlRendererTest>
            <SaveModel id="saveModel">
              <htmlTagId>saveModel</htmlTagId>
              <serializeUrl>/mapbuilder/writeXml</serializeUrl>
              <outputNodeId>saveModelOutput</outputNodeId>
            </SaveModel>
          </widgets>
        </GetFeature>
      </models>
			<widgets>
        <Widget id="featureList">
          <stylesheet>/mapbuilder/lib/widget/SelectFeatureType.xsl</stylesheet>
        </Widget>
				<DescribeFeatureTypeRequest>
          <targetModel>featureTypeTemplate</targetModel>
				</DescribeFeatureTypeRequest>
        <GetFeatureRequest id="getFeatureRequest">
          <debug/>
          <targetModel>getFeatureTemplate</targetModel>
          <tools>
          </tools>
        </GetFeatureRequest>
			</widgets>
		</WfsCapabilities>
    
  </models>

  <widgets>
    <ButtonBar id="buttonBar">
      <targetModel>mainMap</targetModel>
      <tools>
        <ZoomIn id="zoomIn">
          <mouseHandler>mainMap.mainMapWidget</mouseHandler>
          <dependsOn>mainMap.mainMapWidget.AoiMouseHandler</dependsOn>
          <dependsOn>mainMap.mainMapWidget.AoiBox</dependsOn>
          <class>RadioButton</class>
          <selected>true</selected>
          <enabledSrc>/images/ZoomInEnable.gif</enabledSrc>
          <disabledSrc>/images/ZoomInDisable.gif</disabledSrc>
          <tooltip xml:lang="en">click and drag to zoom in</tooltip>
          <tooltip xml:lang="fr">cliquer et faire glisser la souris pour agrandir</tooltip>
        </ZoomIn>
        <ZoomOut id="zoomOut">
          <mouseHandler>mainMap.mainMapWidget</mouseHandler>
          <dependsOn>mainMap.mainMapWidget.AoiMouseHandler</dependsOn>
          <dependsOn>mainMap.mainMapWidget.AoiBox</dependsOn>
          <class>RadioButton</class>
          <enabledSrc>/images/ZoomOutEnable.gif</enabledSrc>
          <disabledSrc>/images/ZoomOutDisable.gif</disabledSrc>
          <tooltip xml:lang="en">click to zoom out</tooltip>
          <tooltip xml:lang="fr">cliquer pour réire</tooltip>
        </ZoomOut>
        <DragPan id="dragPan">
          <mouseHandler>mainMap.mainMapWidget</mouseHandler>
          <dependsOn>mainMap.mainMapWidget.DragPanHandler</dependsOn>
          <class>RadioButton</class>
          <enabledSrc>/images/PanEnable.gif</enabledSrc>
          <disabledSrc>/images/PanDisable.gif</disabledSrc>
          <tooltip xml:lang="en">click and drag to pan</tooltip>
          <tooltip xml:lang="fr">cliquer et faire glisser la souris pour voir un autre parti de la carte</tooltip>
        </DragPan>
        <SetAoi id="setAoi">
          <mouseHandler>mainMap.mainMapWidget</mouseHandler>
          <dependsOn>mainMap.mainMapWidget.AoiMouseHandler</dependsOn>
          <dependsOn>mainMap.mainMapWidget.AoiBox</dependsOn>
          <class>RadioButton</class>
          <enabledSrc>/images/SetAoiEnable.gif</enabledSrc>
          <disabledSrc>/images/SetAoiDisable.gif</disabledSrc>
          <tooltip xml:lang="en">click and drag to set the area of interest</tooltip>
          <tooltip xml:lang="fr">cliquer et faire glisser la souris pour positionner une réon d'intét</tooltip>
        </SetAoi>
        <Reset id="reset">
          <class>Button</class>
          <disabledSrc>/images/ResetExtentDisable.gif</disabledSrc>
          <tooltip xml:lang="en">reset the map to full extent</tooltip>
          <tooltip xml:lang="fr">redonner à la carte ses dimensions complès</tooltip>
        </Reset>
        <GetFeatureInfo id="getFeatureInfo">
          <mouseHandler>mainMap.mainMapWidget</mouseHandler>
          <dependsOn>mainMap.mainMapWidget.MouseClickHandler</dependsOn>
          <class>RadioButton</class>
          <enabledSrc>/images/QueryEnable.gif</enabledSrc>
          <disabledSrc>/images/QueryDisable.gif</disabledSrc>
          <tooltip xml:lang="en">click on feature for more info</tooltip>
          <tooltip xml:lang="fr">cliquer pour obtenir plus d'information pour cette couche</tooltip>
          <targetFeatureCollection>gml2</targetFeatureCollection>
        </GetFeatureInfo>
      </tools>
    </ButtonBar>
    <ModelUrlInput id="urlInput">
      <targetModel>wfsCapTemplate</targetModel>
    </ModelUrlInput>
  </widgets>
      
  <!--
    All static images should be relative to this URL.
    This dir is relative the dir of the main html file.
  -->
  <skinDir>/mapbuilder/lib/skin/default</skinDir>
  <proxyUrl>/mapbuilder/proxy?url=</proxyUrl>

</MapbuilderConfig>
